CODICE_MUSEO,CODICE_SEDE,PROVINCIA_SEDE,COMUNE_SEDE,DENOMINAZIONE_MUSEO,DENOMINAZIONE_SEDE,INDIRIZZO_SEDE,FRAZIONE_SEDE,CAP_SEDE,TELEFONO_SEDE,FAX_SEDE,EMAIL_SEDE,SITO_WEB_SEDE,SITO_WEB_SEDE_1,NOTE_SEDE,TIPO_RICONOSCIMENTO,TIPOLOGIA_MUSEO,TIPOLOGIA_ENTE_PROPRIETARIO,APERTURA_SEDE,TIPO_CHIUSURA,MOTIVAZIONE_CHIUSURA_TEMPO_DET,NOTE_APERTURA,DESCRIZIONE_ORARI_APERTURA,CHIUSURA_SETTIMANALE,NOTE_ORARI_APERTURA,PARCHEGGI_VICINI,PARCHEGGI_PERS_DISABILITA,BIGLIETTERIA,GUARDAROBA,AREA_ACCOGLIENZA,BOOKSHOP,CAFFETTERIA,AREA_ASSISTENZA_INFANZIA,NOTE_SPAZI_SERVIZIO_PUBBLICO,LABORATORIO_FOTOGRAFICO,LABORATORIO_RESTAURO,LABORATORIO_PREPARAZIONE,LABORATORIO_ANALISI,NOTE_LABORATORI,SERVIZI_IGIENICI,SERV_IG_PERS_DISABILITA,DOTAZ_INFORMATICHE_STUDIO,DOTAZ_INFORMATICHE_AREE_ESP,TIPO_ACCESSO_PERS_DISABILITA,GRATUITO_PAGAMENTO,GIORNO_INGRESSO_GRATIS,PREZZO_INTERO_EURO,PREZZO_RIDOTTO_EURO,PREZZO_GRUPPI_EURO,PREZZO_SCUOLE_EURO,PREZZO_ALTRO_EURO,BIGLIETTO_CUMULATIVO,FIDELIZZAZIONE,ABBONAMENTO,NOTE_MODALITA_ACCESSO,ANNO_RIF_VISITATORI,TOTALE_VISITATORI,SINGOLI,UNDER_18_OVER_65,GRUPPI_SCOLASTICI,GRUPPI_ORGANIZZATI,NOTE_AFFLUENZA_PUBBLICO,STORICO_VISITATORI,DOTATO_CARTA_SERVIZI,SERVIZIO_EDUCATIVO,BIBLIOTECA,FOTOTECA,ARCHIVIO,DEPOSITI_CONSULTABILI,ALTRO,NOTE_SERVIZI_UTENTI,DISP_SERVIZI_ONLINE,PRENOTAZIONE_ONLINE,ACQUISTI_ONLINE,CONSULTAZIONE_ARCHIVI_ONLINE,NOTE_SERVIZI_ONLINE,WGS84_X,WGS84_Y,LOCATION
1,1,BG,CAMERATA CORNELLO,MUSEO DEI TASSO E DELLA STORIA POSTALE,Museo del Tasso,Via Cornello 22,,24010,034543479,034543479,info@museodeitasso.com,http://www.museodeitasso.com,,,Raccolta Museale,Storia,ENTE PUBBLICO,SI,,,,Da mercoledì a domenica dalle 10.00 alle 12.00 e dalle 14.00 alle 18.00,Lunedì e martedì. Con eccezione del periodo estivo.,,SI,NO,NO,NO,SI,SI,NO,NO,,NO,NO,NO,NO,,SI,NO,NO,NO,ACCESSO ASSENTE,GRATUITO,,,,,,,NO,SI,NO,L'ingresso al Museo è gratuito. Il Museo ha un tariffario per le visite guidate rivolte ai gruppi e ai privati e alle scuole.,2019,12684,10895,4576,361,1428,"I numeri dei visitatori certi sono quelli legati ai gruppi organizzati e gruppi scolastici. Per quantpo riguarda i vistatori singoli e la divisione per età, si tratta di stime, non avendo lo sbigliettamento. I calcoli sono fatti calcolando ogni giorno l'entrata di ogni singolo visitatore nella sala 1 dove si trova il front-office  del museo.",(2019:12684)|(2018:10975)|(2017:11833)|(2016:10047)|(2015:7912),NO,SI,SI,NO,NO,SI,NO,,SI,SI,SI,SI,,9.6545868,45.8964306,"(45.8964306, 9.6545868)"
41,162,BG,ZOGNO,FONDAZIONE POLLI-STOPPANI.ONLUS,Fondazione Polli-Stoppani.Onlus,Via Mazzini. 3,,24019,0345 91473,0345 50866,museodellavallezogno@virgilio.it,http://www.museodellavalle.it,,,Raccolta Museale,Composito,ENTE DI DIRITTO PRIVATO,SI,,,,Da mrtedì a domenica  9 -12  14 -17.  Chiuso il lunedì,Lunedì,,,,SI,NO,SI,SI,NO,SI,"Per l'intrattenimento del pubblico il museo si avvale di:
- ingresso
- sala delle conferenze
- quadriporto nel giaridno",NO,NO,NO,NO,In allestimento prossimo un laboratorio di ricerca e restauro.,SI,SI,NO,NO,ACCESSO TOTALE,A PAGAMENTO,"Prima domanica del mese, notti bianche, conferenze, mostre, eventi.",3.5,2,,,,NO,NO,NO,"Ingresso gratuito per accompagnatori scolaresche e comitive.
Laboratori didattici.",2019,476,,,139,155,,(2019:476)|(2018:828)|(2017:306)|(2016:1179)|(2015:1299),NO,NO,SI,SI,NO,NO,NO,,SI,NO,NO,SI,,9.6653782,45.7942988,"(45.7942988, 9.6653782)"
28,182,BG,ALZANO LOMBARDO,MUSEO D'ARTE SACRA S. MARTINO,Museo d'arte Sacra San Martino,Piazza Italia 8,,24022,035 516579,035 511123,info@museosanmartino.org,http://www.museosanmartino.org,,,Raccolta Museale,Arte,ENTE ECCLESIASTICO,SI,,,,"domeniche e festivi 15-19

lunedì, mercoledì, giovedì, venerdì 8.30-10.00

tutti i giorni su richiesta",,,SI,SI,SI,NO,SI,NO,NO,NO,,NO,NO,NO,NO,nessuno,SI,SI,SI,SI,ACCESSO PARZIALE,A PAGAMENTO,,6,5,,4,3,NO,SI,NO,l'ingresso al Museo è gratuito per i residenti del comune di Alzano Lombardo e per gli studenti degli istituti scolasctici in Alzano Lombardo,2019,3126,963,,284,1879,,(2019:3126)|(2018:4324)|(2017:4564)|(2016:4327)|(2015:6066),NO,NO,NO,NO,SI,NO,NO,la Biblioteca è in fase di organizzazione.,NO,NO,NO,NO,,9.7304172,45.733634,"(45.733634, 9.7304172)"
1901,1962,BG,CASAZZA,MUSEO DELLA VAL CAVALLINA,Museo della Val Cavallina,"Via Nazionale, 67",,24060,035 810640,035 811536,info@museocavellas.it,http://www.museocavellas.it,,,Raccolta Museale,Territoriale,ASSOCIAZIONE RICONOSCIUTA,SI,,,"Apertura il mercoledì dalle 9 alle 12,30 e il sabato e domenica dalle 15,00 alle 18,30","mercoledì dalle 9 alle 12,30,sabato e domenica dalle 15,00 alle 18,30
altri orari su prenotazione",,,SI,SI,NO,NO,SI,NO,NO,NO,,NO,NO,SI,NO,,SI,SI,SI,SI,ACCESSO TOTALE,GRATUITO,,,,,,,NO,NO,NO,"Dal 2017 gli orari di apertura sono i seguenti:
SABATO dalle 15,00 alle 18,00
DOMENICA dalle 10,00 alle 12,30 e dalle 15,00 alle 18,00",2019,2785,645,,,2140,Il numero dei visitatori in gruppo organizzato comprende sia gruppi scolastici sia gruppi organizzati,(2019:2785)|(2018:2630)|(2017:2540)|(2016:2130)|(2015:2550),NO,SI,SI,SI,SI,NO,NO,Accesso informatizzato alla banca dati di immagini e dati del Museo.,SI,SI,NO,SI,"Informazioni, riferimenti,consultazioni,notizie su eventi organizzati e da organizzare...",9.9086234,45.7504991,"(45.7504991, 9.9086234)"
2001,2082,BG,ALMENNO SAN BARTOLOMEO,MUSEO DEL FALEGNAME TINO SANA,Museo del Falegname Tino Sana Onlus,"Via Papa Giovanni XXIII, 55",,24030,035 554411,035 554407,museo@tinosana.com,http://www.museotinosana.it,,,Raccolta Museale,Etnografica e Antropologica,ENTE DI DIRITTO PRIVATO,SI,,,,"Dal lunedì al venerdì dalle 9,00 alle 12,00
sabato dalle 15,00 alle 18,00
domenica dalle 9,30 alle 12,00 e dalle 15,00 alle 18,00
Disponibilità di visita anche in altri orari previa prenotazione.",,,SI,SI,SI,NO,SI,SI,SI,NO,,NO,SI,SI,NO,,SI,SI,SI,NO,ACCESSO TOTALE,A PAGAMENTO,in base a manifestazioni particolari.,8,4,4,4,,NO,NO,NO,"Altro: l'ingresso è gratuito per disabili, portatori di handicap e in occasione di particolari eventi.",2019,8300,,,2000,,,(2019:8300)|(2018:7800)|(2017:7432)|(2016:6600)|(2015:6000),NO,SI,SI,SI,NO,SI,NO,,SI,SI,NO,NO,,9.5953609,45.7023468,"(45.7023468, 9.5953609)"
2042,2102,BG,SCHILPARIO,MUSEO ETNOGRAFICO,Museo Etnografico,Via dei Goi,,24020,034655393,034655275,info@comune.schilpario.bg.it,http://www.cmscalve.bg.it,,,Museo,Etnografica e Antropologica,ENTE LOCALE E SUE FORME ASSOCIATIVE E CONSORTILI,SI,,,,"9:00 - 12:00
15:00 - 18:00",lunedì,,SI,SI,SI,NO,NO,NO,NO,NO,,NO,NO,NO,NO,,SI,SI,SI,SI,ACCESSO TOTALE,A PAGAMENTO,,5,3,3,3,1.5,NO,NO,NO,Ingresso libero per gruppi superiori a 10 membri,2019,3348,1954,2228,918,476,,(2019:3348)|(2018:4000)|(2017:4050)|(2016:4000)|(2015:3500),NO,SI,SI,SI,SI,SI,NO,,NO,NO,NO,NO,,10.1580278,46.0086739,"(46.0086739, 10.1580278)"
2065,2382,BG,URGNANO,MUSEO E VILLAGGIO AFRICANO,MUSEO E VILLAGGIO AFRICANO,VIA G. B. PERUZZO 2,BASELLA,24059,035-894670,035-5096977,info@museoafricano.it,http://www.museoafricano.it,,,Museo,Etnografica e Antropologica,ENTE DI DIRITTO PRIVATO,SI,,,"da lunedi a venerdi 9.00-17.00
sabato chiuso
domenica 15.00-18.00","da lunedi a venerdi 9.00-16.00
sabato chiuso
domenica 15.00-18.00",SABATO,,SI,NO,SI,NO,SI,SI,SI,NO,,NO,NO,NO,NO,"Come detto sopra, laboratorio per attività di manipolazione all'interno di percorsi didattici per le scuole.",SI,SI,SI,SI,ACCESSO TOTALE,A PAGAMENTO,,2,0,1,8,7,NO,SI,NO,"Gli importi indicati sono quelli minimi praticati durante la bassa stagione (settembre-febbraio)dell'a.s. 2016/17
Con Altro si intendono i Centri Estivi.
Per questi ultimi e per le scuole l'ingresso al museo comprende anche dei laboratori interattivi.",2019,12343,121,137,8043,4042,Gruppo organizzato= Centri estivi e cooperative dsa,(2019:12343)|(2018:12343)|(2017:9197)|(2016:11002)|(2015:11442),NO,SI,SI,NO,NO,SI,SI,,SI,SI,NO,NO,,9.7260821,45.613753,"(45.613753, 9.7260821)"
1982,3848,BG,TREVIGLIO,MUSEO CIVICO ERNESTO  E TERESA DELLA TORRE,Museo Archeologico Giuseppe Oggionni,"vicolo Bicetti de Buttinoni, 11",,,,,trevigliomusei@comune.treviglio.bg.it,http://comune.treviglio.bg.it,,,Raccolta Museale,Composito,ENTE LOCALE E SUE FORME ASSOCIATIVE E CONSORTILI,SI,,,,"martedì e sabato 14.30-18.00
terza domenica del mese 15.00-18.00
In altri giorni e orari su richiesta",,gli orari potrebbero variare a causa del riallestimento in corso,SI,SI,NO,NO,SI,NO,NO,SI,,NO,NO,NO,NO,,SI,SI,SI,SI,ACCESSO TOTALE,GRATUITO,,,,,,,NO,NO,NO,"La gratuità si riferisce a tre delle sedi del Museo Civico. Nella sede denominata Museo Storico Verticale è previsto un biglietto d'ingresso di €5.00 intero, €4.00 under 18, gratuito per i under 6 e €7.00 adulto + ragazzo.",2019,19718,5348,3169,13691,679,dati reali tranne over 60 e under 18 che sono stimati,(2019:19718)|(2018:14864)|(2017:14743)|(2016:5836)|(2015:5000),NO,SI,SI,SI,SI,NO,NO,,NO,NO,NO,NO,,9.58833219,45.51966949,"(45.51966949, 9.58833219)"
62,226,BS,BRESCIA,MUSEO CIVICO DI SCIENZE NATURALI,Museo Civico di Scienze Naturali,"Via Ozanam, 4",,25128,030 2978672,030 2978597,museo.scienze@comune.brescia.it,http://www.comune.brescia.it,,Per lavori sull’edificio l'esposizione permanente del Museo è attualmente (2020) chiusa al pubblico.,Raccolta Museale,Storia Naturale e scienze naturali,COMUNE,NO,a tempo determinato,Restauro Sede,,"Dal lunedì al sabato dalle ore 9:00 alle 13:45 o dalle ore 14:00 alle 19:00. Domenica chiuso.
In fascia serale dal lunedì al venerdì dalle ore 20:00 alle 23:30 è aperto auditorium e sala conferenze.","Domenica
Apertura domenicale per eventi particolari",,SI,SI,NO,SI,SI,NO,NO,NO,Guardaroba disponibile per le scolaresche,NO,NO,SI,NO,,SI,SI,SI,SI,ACCESSO PARZIALE,GRATUITO,,,,,,,NO,NO,NO,,2019,6464,2988,,2786,690,,(2019:6464)|(2018:18128)|(2017:17797)|(2016:19476)|(2015:11600),NO,SI,SI,NO,NO,SI,SI,"Specola Astronomica Cidnea
Biblioteca condivisa con il Servizio Biblioteche del Settore Cultura",SI,NO,NO,SI,"Sul sito del Museo è possibile visionare gli orari di apertura del Museo e il calendario delle attività, scaricare gratutitamente schede didattiche e tutti gli articoli pubblicati nei periodici scientifici editi dal Museo stesso.",10.2274249,45.5531906,"(45.5531906, 10.2274249)"
502,662,BS,GAVARDO,MUSEO ARCHEOLOGICO DELLA VALLE SABBIA,Museo archeologico della Valle Sabbia,"Piazzetta San Bernardino, 5",,25085,0365 371474,0365377417,info@museoarcheologicogavardo.it,http://museoarcheologicogavardo.it,,,Museo,Archeologia,COMUNE,SI,,,,"dal lunedì al mercoledì dalle ore 9.00 alle ore 13.00 
il giovedì dalle 9.00 alle 13.00 e dalle 14.00 alle 17.00
venerdì dalle 9.00 alle 13.00 e dalle 20.30 alle 21.30.
domenica dalle 14,30 alle 18,30

orario estivo:
dal lunedì al mercoledì dalle ore 9.00 alle ore 13.00 
il giovedì dalle 9.00 alle 13.00 e dalle 16.00 alle 19.00
venerdì dalle 9.00 alle 13.00 e dalle 20.30 alle 21.30.
domenica dalle 14,30 alle 18,30",sabato,,SI,SI,SI,NO,NO,NO,NO,NO,,NO,NO,NO,SI,"Su finanziamento europeo è stato acquistato un stereoscopio trioculare a luce riflessa con innesto per macchina digitale per avviare uno studio sulle tracce di usura dei supporti litici di epoca preistorica, in collaborazione con l'università di Roma.",SI,SI,SI,SI,ACCESSO PARZIALE,A PAGAMENTO,venerdì sera,4,2,70,,,NO,SI,SI,"Per alcune iniziative didattiche (del tipo un mercoledì da museo) si prevedono forme di abbonamento. Per alcune categorie di utenti è previsto l'ingresso gratuito. Per i gruppi si intende il costo della visita guidata. Per le scuole sono presenti numerose tipologie di offerte: per gruppi classe di max 25 alunni € 70,00 percorso didattico con fascicolo: € 70,00 Laboratorio didattico; € 80,00 percorso + minilaboratorio; € 120,00 Percorso + laboratorio; € 135 giornata intera da concordare.",2019,4805,2903,834,1540,362,"La rilevazione della classe di età è parziale e non tiene conto dei visitatori di eventi, mostre, inaugurazioni e domeniche (quando l'ingresso è gratuito o a tariffa speciale)",(2019:4805)|(2018:4898)|(2017:4829)|(2016:4520)|(2015:4600),NO,SI,SI,SI,NO,SI,NO,I depositi sono visitabili solo su appuntamento.,NO,NO,NO,NO,,10.4389872,45.5847605,"(45.5847605, 10.4389872)"
482,623,BS,DESENZANO DEL GARDA,MUSEO CIVICO ARCHEOLOGICO,Museo Archeologico Rambotti,"Via T. Dal Molin, 7C",,25015,030 9144529,,museo@comune.desenzano.brescia.it,http://www.onde.net/desenzano/citta/museo/index.htm,,,Museo,Archeologia,COMUNE,SI,,,,"martedì e mercoledì dalle 9.00 alle 13.00
giovedì e venerdì dalle 15 alle 19
sabato, domenica e festivi 14.30-19. 
Chiuso il lunedì",lunedì,,SI,SI,SI,SI,SI,SI,NO,NO,E' presente un'aula didattica.,NO,NO,NO,NO,,SI,SI,SI,SI,ACCESSO TOTALE,A PAGAMENTO,prima domenica del mese,4,2,,,,SI,NO,NO,"Biglietto intero cumulativo Museo-Castello: euro 5,00 - ridotto euro 2,00",2019,6107,4297,,1810,,,(2019:6107)|(2018:5571)|(2017:2947)|(2016:4925)|(2015:6057),SI,SI,SI,NO,SI,SI,SI,Aula didattica dove si svolgono incontri  e laboratori con i bambini,NO,NO,NO,NO,,10.5424668,45.4690064,"(45.4690064, 10.5424668)"
2357,2411,BS,TOSCOLANO-MADERNO,ORTO BOTANICO SPERIMENTALE 'G. E. GHIRARDI',Orto Botanico Sperimantale 'G. E. Ghirardi',Via Religione,,25088,02 50314863-0250314770,02 50314862,"elisabetta.marcosini@unimi.it, gelsomina.fico@unimi.it",http://www.reteortibotanicilombardia.it,,,Raccolta Museale,Orto botanico,UNIVERSITA' STATALI - NON STATALI,SI,,,,"15 Aprile - 15 Ottobre
Lun, mar, gio, ven: 8.00 - 12.00; 13.00-16.00
Mer 13.00 -20.00
Sab: 9.30-12.30 e terzo sabato del mese in aggiunta 16.00-20.00.",domenica,,SI,SI,NO,NO,SI,NO,NO,NO,,NO,NO,SI,NO,,SI,NO,NO,NO,ACCESSO PARZIALE,GRATUITO,,,,,,,,,,,2019,4500,2000,1350,1800,700,,(2019:4500)|(2018:10000)|(2017:12000)|(2016:12000)|(2015:7500),NO,SI,NO,NO,NO,SI,SI,Archivio fotografico e raccolta di campioni da erbario che di anno in anno si incrementano,SI,SI,NO,SI,,10.6135877,45.638213,"(45.638213, 10.6135877)"
601,742,BS,MANERBIO,Museo Civico di Manerbio e del territorio,Museo civico archeologico,"Piazza Cesare Battisti, 1",,25025,0309387293,0309387297,museo@comune.manerbio.bs.it,http://www.comune.manerbio.bs.it,,,Museo,Archeologia,COMUNE,SI,,,,"Martedì, mercoledì e venerdì: 9.00-12.30/14.30-16.30
giovedì 14.30-16.30/20.30-22.30
sabato: 9.00-12.30
domenica: 16.00-19.00",lunedì; giovedì mattina,,SI,SI,SI,NO,SI,NO,NO,NO,In casi di particolare affluenza vengono condivisi gli spazi della biblioteca.,NO,NO,SI,NO,,SI,SI,SI,NO,ACCESSO TOTALE,GRATUITO,,,,,,,NO,NO,NO,,2019,1309,915,,394,,,(2019:1309)|(2018:1727)|(2017:1857)|(2016:2623)|(2015:1884),SI,SI,SI,NO,SI,SI,NO,,SI,SI,NO,NO,,10.1388499,45.3547946,"(45.3547946, 10.1388499)"
2445,2471,BS,MONTICHIARI,Museo Demologico Giacomo Bergomi,Museo Demologico Giacomo Bergomi,VIA BRESCIA 129,BRESCIA,25018,0309650455,,info@montichiarimusei.it,http://www.montichiarimusei.it,,,Raccolta Museale,Etnografica e Antropologica,ENTE LOCALE E SUE FORME ASSOCIATIVE E CONSORTILI,SI,,,,"Venerdì e sabato 10-13 e 14-18
Domenica 14,30-19",Lunedì,,SI,SI,SI,SI,SI,NO,NO,SI,CAFFETTERIA E RISTORANTE SONO ATTIGUI AL CENTRO FIERA,NO,NO,NO,NO,,SI,SI,SI,NO,ACCESSO TOTALE,GRATUITO,,,,,,,NO,SI,NO,,2019,6634,,,,,,(2019:6634)|(2018:5643)|(2017:5718)|(2016:6000)|(2015:5900),NO,SI,SI,NO,SI,SI,NO,,SI,SI,NO,SI,,10.3770994,45.4199981,"(45.4199981, 10.3770994)"
2503,2563,BS,GARDONE VAL TROMPIA,MUSEO DELLE ARMI E DELLA TRADIZIONE ARMIERA,Biblioteca,Via XX Settembre,,25063,030.832187,030.832706,info@museodellearmi.net,http://www.museodellearmi.net,,,Museo,Specializzato,ENTE LOCALE E SUE FORME ASSOCIATIVE E CONSORTILI,SI,,,,"Lunedì chiuso
martedì 14.30-18.30
mercoledì  14.30-18.30
giovedì 9.00-12.00 14.30-18.30
venerdì 9.00-12.00  14.30-18.30
sabato 9.00 - 12.00",,"Sempre su appuntamento per utenza specializzata, su prenotazione per gruppi o classi.",SI,SI,SI,SI,SI,SI,NO,SI,L'area per la prima infanzia è quella della biblioteca,NO,NO,NO,SI,,SI,SI,SI,NO,ACCESSO TOTALE,A PAGAMENTO,Gratuito per i residenti dei Comuni aderenti al Sistema museale.,5,3,,,,SI,SI,SI,pagamento di visite guidate (euro 60 per gruppi di 25 persone) e dei laboratori (euro 90 per gruppi di 25 persone) per gruppi e classi da aggiungere al costo del biglietto.,2019,1679,662,518,955,62,,(2019:1679)|(2018:685)|(2017:899)|(2016:2875)|(2015:2327),SI,SI,SI,NO,SI,NO,SI,"Altro: Nel museo sono presenti laboratori per utenza specializzata, oltre che un laboratorio per la didattica.
Nell'edificio è presente la biblioteca di pubblica lettura che ha un settore specializzato sulla storia locale e sulle armi. E' anche presente l'archivio storico della caccia.
Si stanno realizzando degli archivi su importanti temi del lavoro armiero a Gardone V.T.",SI,SI,NO,NO,In collaborazione con il Sistema museale di Valle Trompia.,10.184521,45.6879756,"(45.6879756, 10.184521)"
444,2572,BS,BIENNO,"MUSEO ETNOGRAFICO DEL FERRO, DELLE ARTI E DELLE TRADIZIONI POPOLARI",Fucina Espositiva,Via Resoleto,,25040,0364306008,0364406610,info@comune.bienno.bs.it,http://www.comune.bienno.bs.it,,,Museo,Etnografica e Antropologica,COMUNE,SI,,,,"Dal lunedì  al venerdì dalle ore 9,30 alle ore 11,30 e dalle 14.30 alle 17.30 anche su richiesta.",,,SI,SI,NO,NO,SI,NO,NO,NO,,NO,NO,SI,NO,,NO,,NO,NO,ACCESSO PARZIALE,A PAGAMENTO,solo in occasione di eventi particolari,2,1.5,,,1,NO,NO,NO,"Per le strutture ricettive e Agenzie Viaggi il biglietto ha una riduzione del 50%
I biglietti vengono venduti anche presso l'ufficio turistico sito in piazza Liberazione a Bienno.

Le tariffe deliberate sono anche: Euro 3,00 Intero per ingresso a più musei ed Euro 2,00 Ridotto per ingresso più Musei.",2019,4015,1086,,1254,1675,,(2019:4015)|(2018:4015)|(2017:5033)|(2016:4560)|(2015:4200),NO,SI,SI,NO,SI,SI,NO,BIBLIOTECA COMUNALE CON SEZIONE ETNOGRAFICA CONTENENTE TESTI ATTINENTI L'ATTIVITA' DI LAVORAZIONE DEL FERRO E STUDI SCIENTIFICI AD ESSA COLLEGATI.,SI,SI,NO,NO,,10.299058,45.932737,"(45.932737, 10.299058)"
1002,1183,CR,CREMONA,MUSEO DELLA CIVILTA' CONTADINA IL CAMBONINO VECCHIO,Museo della Civiltà Contadina il Cambonino Vecchio,"Viale Cambonino, 22",,26100,0372  560025,0372 560025,museo.cambonino@comune.cremona.it,http://www.musei.comune.cremona.it,,,Museo,Etnografica e Antropologica,ENTE LOCALE E SUE FORME ASSOCIATIVE E CONSORTILI,SI,,,,da lunedì a sabato 8.45 -13.00,,Annualmente si valuta l'opportunità della chiusura del museo nel periodo di chiusura delle scuole.,SI,,SI,SI,NO,NO,NO,NO,,NO,NO,NO,NO,,SI,SI,SI,NO,ACCESSO PARZIALE,GRATUITO,,,,,,,,,,,2019,9230,5528,,3702,,I visitatori in gruppo organizzato non sono rilevati.,(2019:9230)|(2018:6500)|(2017:5868)|(2016:4848)|(2015:6951),SI,SI,SI,SI,SI,SI,NO,,NO,NO,NO,NO,,9.9980708,45.1518235,"(45.1518235, 9.9980708)"
1581,1682,MN,BORGO VIRGILIO,MUSEO VIRGILIANO,Museo Virgiliano,"Via Parma, 34",Pietole,46030,,0376280368,servizipersona@comune.virgilio.mn.it,https://www.borgovirgilio.gov.it,,,Raccolta Museale,Composito,ENTE PUBBLICO,SI,,,,GENERALMENTE IL MUSEO E' APERTO NEL FINE SETTIMANA: VENERDI' - SABATO E DOMENICA DALLE 10 ALLE 12 E DALLE 15 ALLE 18.,,,SI,SI,NO,NO,NO,NO,NO,NO,,NO,NO,NO,NO,,SI,SI,NO,NO,ACCESSO TOTALE,GRATUITO,,,,,,,NO,NO,NO,,2019,740,540,,100,,,(2019:740)|(2018:)|(2017:352)|(2016:500)|(2015:500),NO,NO,NO,NO,NO,SI,SI,fornitura cataloghi.,NO,NO,NO,NO,,10.818059,45.1133204,"(45.1133204, 10.818059)"
2558,2685,BS,BRESCIA,MUSEO DELL'INDUSTRIA E DEL LAVORO DI BRESCIA,MUSEO DEL FERRO,Via del Manestro 107-111,,25136,030 3750663,030 2404554,fondazione@musil.bs.it,http://www.musilsanbartolomeo.it,,,Museo,Scienza e Tecnica,FONDAZIONE (ESCLUSA FONDAZIONE BANCARIA),SI,,,,Il Museo è aperto su prenotazione e visite guidate.,,,NO,NO,SI,SI,NO,SI,NO,NO,,NO,NO,SI,NO,,SI,SI,NO,SI,ACCESSO TOTALE,A PAGAMENTO,,4,3,5,5,,NO,NO,NO,,2019,10592,5255,1381,4252,1085,Nella casella Under 18+ Over 60 è stato inserito il totale dei biglietti ridotti singoli (Under 25 + Over 65),(2019:10592)|(2018:11336)|(2017:14650)|(2016:15250)|(2015:16500),SI,SI,SI,SI,SI,SI,NO,,SI,NO,NO,SI,"Il sito www.musilbrescia.it offre ampia possibilità di ricerca sull'intero patrimonio e sull'attività del Museo.
Da circa un anno il Musil è anche molto attivo su Facebook (https://www.facebook.com/musilbrescia/).",10.2217677,45.5765071,"(45.5765071, 10.2217677)"
581,2672,BS,MALEGNO,MUSEO CIVICO LE FUDINE,Museo le Fudine,Via Sant'Antonio,,25053,0364/340500,0364/344463,info@comune.malegno.bs.it,http://www.comune.malegno.bs.it,,,Raccolta Museale,Etnografica e Antropologica,ENTE PUBBLICO,SI,,,"Martedì 16-18
Giovedì 14 - 18
Sabato 9-12 14-18","Martedì dalle 16.00 alle 18.00, giovedì dalle 14.30 alle 16.30 e sabato dalle 14.00 alle 16.00.",lunedì mercoledi venerdì domenica,,SI,SI,SI,NO,SI,NO,NO,NO,,NO,NO,NO,NO,,SI,SI,SI,NO,ACCESSO TOTALE,GRATUITO,,0,0,0,0,,NO,NO,NO,,2019,605,370,,120,50,,(2019:605)|(2018:255)|(2017:620)|(2016:2000)|(2015:2000),NO,SI,SI,NO,SI,SI,NO,,NO,NO,NO,NO,,10.2762238,45.9508214,"(45.9508214, 10.2762238)"
3276,2976,BS,MONTICHIARI,Museo Luigi e Piero Lechi,Museo Luigi e Piero Lechi,via Martiri della Libert 33,,25018,0309650455,,info@montichiarimusei.it,http://www.montichiarimusei.it,,,Museo,Arte,ENTE LOCALE E SUE FORME ASSOCIATIVE E CONSORTILI,SI,,,,"dal mercoledì al sabato ore 10-13 e ore 14.30-18
domenica ore 15-19",lunedì e martedì,,SI,SI,SI,SI,NO,NO,NO,NO,,NO,NO,SI,NO,,SI,SI,NO,SI,ACCESSO TOTALE,A PAGAMENTO,,5,3,,,,NO,NO,NO,,2019,4512,,,,,,(2019:4512)|(2018:3201)|(2017:8842)|(2016:3000)|(2015:0),NO,SI,SI,SI,NO,SI,NO,,NO,NO,NO,NO,,10.3896803,45.4126822,"(45.4126822, 10.3896803)"
2257,2305,PV,STRADELLA,MUSEO CIVICO DELLA FISARMONICA 'MARIANO DALLAPÈ',Civico Museo della Fisarmonica 'Mariano Dallapè',Via Montebello 2,,27049,0385 42069,0385 43590,info@comune.stradella.pv.it,https://www.comune.stradella.pv.it,,"il fax è quello del Comune.
Le collezioni museali sono presenti anche sui siti web:
www.comune.stradella.pv.it
www.aess.regione.lombardia.it
www.lombardiabeniculturali.it
Comunicazione 09/08/2018: il sito dei Musei, in questo momento non attivo, verrà aggiornato e riaperto a breve.",Raccolta Museale,Specializzato,ENTE PUBBLICO,SI,,,,"LUNEDì 15 - 18
MARTEDì 9 - 12
MERCOLEDì 9 - 12
GIOVEDì 9 -12
VENERDì 15 -18
SABATO 9-12
DOMENICA E FESTIVI  15 - 18",,,SI,SI,SI,NO,SI,NO,NO,NO,,NO,SI,SI,NO,xxxxxxxxxxxxxxxx,SI,SI,NO,NO,ACCESSO TOTALE,A PAGAMENTO,"Fai il pieno di cultura, eventi MIBAC, ecc.",3.5,,3,2,,NO,NO,NO,,2019,,,,,,,(2019:0)|(2018:260)|(2017:553)|(2016:688)|(2015:1000),NO,SI,NO,NO,NO,NO,NO,,NO,NO,NO,NO,,9.2959114,45.0750005,"(45.0750005, 9.2959114)"
1063,1244,CR,CASTELLEONE,MUSEO CIVICO,Museo Civico,"Via Roma, 67",,26012,0374 356344,0374 356300,museo@comune.castelleone.cr.it,http://www.comune.castelleone.cr.it,,,Raccolta Museale,Composito,COMUNE,SI,,,,"Martedì 17.00 -18.00 Mercoledì 17.00 - 18.00 Giovedì 17.00 - 18.00 Venerdì 17.00 - 18.00 Sabato  15,30 - 17.30 Domenica 15.30 - 17.30 
apertura dedicata alle scuole, su prenotazione, lunedì dalle 9.00 alle 12.00 apertura straordinaria ogni seconda domenica del mese dalle 15.30 alle 18.30",,Le visite e i laboratori per le scolaresche o per i gruppi di adulti si effettuano al di fuori dell'orario normale,SI,SI,SI,NO,NO,NO,NO,NO,,NO,NO,NO,NO,,SI,SI,NO,NO,ACCESSO TOTALE,GRATUITO,,,,,,,NO,NO,NO,,2019,1208,445,,89,674,Il museo è stato chiuso per imbiancatura dei locali e risanamento della sala dedicata alla collezione malacologica per 2 mesi (novembre-dicembre).,(2019:1208)|(2018:1498)|(2017:1562)|(2016:1500)|(2015:1600),NO,SI,SI,NO,NO,SI,NO,,NO,NO,NO,NO,"Il museo non ha un vero e proprio sito web, ma una sezione del sito del comune. Non vi sono servizi on-line, se non la possibilità di prenotare attività via e-mail.",9.7627989,45.2931165,"(45.2931165, 9.7627989)"
1041,1222,CR,CREMONA,MUSEO DELLA CHIESA CATTEDRALE,Museo delle pietre romaniche della Cattedrale,Piazza  Comune,,26020,0372 495032,,beniculturali@diocesidicremona.it,,,,Raccolta Museale,Archeologia,ENTE ECCLESIASTICO,SI,,,,Tutto l'anno compreso il lunedì dalle 10.00 alle 12.30 e dalle 14.00 alle 17.00.,lunedì.,,SI,SI,SI,SI,SI,SI,NO,NO,,NO,SI,SI,SI,Il Conservatore è docente in pensione della classe XLI dell'Università di Parma.,SI,SI,SI,NO,ACCESSO PARZIALE,A PAGAMENTO,Solo eccezionalmente nelle giornate della cultura,3,2,2,2,,SI,SI,NO,"E' collegato alla salita del Torrazzo, per il quale il biglietto cumulativo è 5 euro, ridotto 4 euro",2019,25900,25900,17800,45,102,,(2019:25900)|(2018:26500)|(2017:30040)|(2016:20000)|(2015:0),NO,SI,NO,NO,NO,NO,NO,,NO,NO,NO,NO,Esiste con l'esterno un collegamento via posta elettronica col quale sono possibili prenotazioni e chiarimenti su orari e costi,10.0191894,45.1409368,"(45.1409368, 10.0191894)"
1221,1363,CR,OFFANENGO,MUSEO DELLA CIVILTA' CONTADINA,Museo  della Civiltà Contadina,Via Tesini angolo via della Rocca,,26010,0373 244084,0373 244571,biblioteca@comune.offanengo.cr.it,http://www.comune.offanengo.cr.it,,,Raccolta Museale,Etnografica e Antropologica,ENTE LOCALE E SUE FORME ASSOCIATIVE E CONSORTILI,SI,,,,"Sabato, domenica e festivi dalle 10.00 alle 12.00 e dalle 15.00 alle 18.00
Orario continuato durante la Fiera Settembre Offanenghese (4 giorni)",,,SI,NO,NO,NO,SI,NO,NO,NO,E' in corso la ristutturazione dell'edificio museale.,NO,NO,NO,NO,,SI,SI,NO,NO,ACCESSO TOTALE,GRATUITO,,,,,,,NO,,,,2019,1610,1160,950,450,,valori stimati,(2019:1610)|(2018:1630)|(2017:1200)|(2016:1143)|(2015:1020),,SI,SI,SI,SI,NO,NO,Il progetto di ristrutturazione dell'edificio museale prevede uno spazio in cui raggruppare la biblioteca del Museo e la documentazione.,SI,SI,NO,NO,"E' allo studio la messa a disposizione di servizi on- line per la consultazione degli archivi del Museo, attraverso il sito web del Comune di Offanengo.",9.741071,45.3777007,"(45.3777007, 9.741071)"
