23,2435,BG,BERGAMO,MUSEO DELLE STORIE DI BERGAMO,Rocca - complesso,Via Rocca,,24129,035 221040,035219128,info@museodellestorie.bergamo.it,http://www.museodellestorie.bergamo.it,,Museo storico di Bergamo - Sezione Ottocento Mauro Gelfi.,Museo,Storia,ENTE LOCALE E SUE FORME ASSOCIATIVE E CONSORTILI,SI,,,,"da Ottobre a Maggio: da martedì a domenica dalledalle 9.30 alle 13.00 e dalle 14.30 alle 18.00;
da Giugno a Settembre: da martedì a venerdì dalle 10.00 alle 13.00 e dalle 14.30 alle 18.00;
                                   sabato e festivi dalle 10.00 alle 18.00
Chiuso il Lunedì non festivo, Natale e Capodanno.",Lunedì non festivo.,,SI,SI,SI,NO,SI,SI,NO,NO,,NO,NO,NO,NO,,SI,SI,NO,SI,ACCESSO PARZIALE,A PAGAMENTO,,3,2,2,,,SI,SI,NO,"L'ingresso sino a 18 anni è gratuito. Gli studenti universitari pagano l'ingresso ridotto.
Il biglietto per ciascuno dei musei della rete del museo storico è 3€ (ridotto 2€) ad eccezione del Palazzo del Podestà il cui ingresso è 5€ (ridotto 3€)
I biglietti dei musei della fondazione sono inseriti nel circuito Abbonamento Musei Lombardia
La fidelizzazione del pubblico avviene anche l'emissione di tessere che prevedono l'ingresso gratuito o ridotto alle sedi ai Donatori e ai membri dell'Associazione Amici del Museo.",2019,152619,141154,,8127,3338,i dati over 60 non sono rilevabili,(2019:152619)|(2018:165197)|(2017:118949)|(2016:81914)|(2015:80451),NO,SI,SI,SI,SI,SI,SI,"Consulenza per tesine di maturità e tesi di laurea
Stage per studenti di istituti scolastici secondari di secondo grado e università",SI,NO,NO,SI,,9.6671905,45.7037821,"(45.7037821, 9.6671905)"
463,603,BS,CETO,"MUSEO DIDATTICO DELLA RISERVA NATURALE E INCISIONE RUPESTRI CETO, CIMBERGO E PASPARDO",Museo didattico,"Via Piana, 29",Nadro,25040,0364 433465,0364 433465,riservaincisioni.museo@arterupestre.it   oppure consorzioincisionirupestri@arterupestre.it,http://www.arterupestre.it,,"Telefono segreteria Ente Gestore:  0364 436129
Il patrimonio della Riserva Regionale dell'Incisioni Rupestri viene spiegato e illustrato all'interno del Museo.",Museo,Archeologia,ENTE LOCALE E SUE FORME ASSOCIATIVE E CONSORTILI,SI,,,,"Orario invernale: 9,00-16,30
Orario estivo: 9,00-17,30
Aperto tutti i giorni escluso Natale e primo  giorno dell'anno ( o in caso di fort nevicate)",nessun giorno di chiusura,,SI,SI,SI,SI,SI,SI,SI,NO,Foresteria per l'accoglienza gratuita.,NO,NO,NO,NO,"Dal 2006 è attivo il Centro di Monitoraggio dell'Area in cui convergono dati riferiti alle Collezioni Archeologiche ed altri dati ambientali. I Gruppi di studio che operano (con cenvenzione e no) all'interno della Riserva, devono depositare una copia dei lori studi/ricerche ed i dati 8anche fotografici).",SI,SI,SI,SI,ACCESSO PARZIALE,A PAGAMENTO,,3,,,,,NO,SI,NO,Si è chiesta l'adesione al sistema Abbonamenti Museo Lombardia,2019,16796,14116,2815,2387,293,4.650 ing. Per manifestazioni e 6500 ingressi senza controllo nell'area archeoloogica,(2019:16796)|(2018:16920)|(2017:17361)|(2016:17300)|(2015:11000),SI,SI,SI,NO,SI,SI,NO,"Biblioteca, fototeca,archivio  si trovano presso il Centro camuno di Studi Preistorici (biblioteca specializzata con oltre 35.000 volumi). Presso il Museo è attiva una piccola biblioteca informativa.",SI,NO,NO,SI,Visita del Museo virtuale attraverso il sito internet della Riserva-Museo.,10.3529483,46.0120301,"(46.0120301, 10.3529483)"
81,2520,BS,MANERBA DEL GARDA,MUSEO CIVICO ARCHEOLOGICO DELLA VALTENESI,MUSEO CIVICO ARCHEOLOGICO DELLA VALTENESI,"via Rocca, 20",,25080,3396137247,0365550517,museodimanerba@libero.it,http://www.riservaroccamanerba.com,,,Raccolta Museale,Archeologia,ENTE PUBBLICO,SI,,,"Il Museo osserva i seguenti orari di apertura al pubblico:
- nel periodo da aprile a settembre aperto tutti i giorni, escluso il martedì, dalle 10.00 alle 18.00;
- nel periodo da ottobre a marzo luned' e martedì chiuso, da mercoledì a venerdì dalle 9.00 alle 13.00, sabato e domenica dalle 10.00 alle 17.00. Chiuso dal 22 gennaio al 4 febbraio 2018.","1 aprile - 30 settembre: lunedì, mercoledì, giovedì, venerdì, sabato e domenica ore 10.00-18.00; martedì: chiuso.

1 ottobre - 30 marzo: lunedì e martedì: chiuso; mercoledì, giovedì, venerdì: 9-13; sabato e domenica ore 10.00-17.00.
Chiuso: lunedì, martedì, 25 e 26 dicembre, l'ultima settimana di gennaio e la prima di febbraio.","lunedì e martedì nel periodo tra 1 ottobre e 30 marzo;
martedì nel periodo tra 1 aprile e 30 settembre.",,SI,SI,NO,NO,NO,SI,SI,NO,,NO,NO,NO,NO,,SI,SI,NO,NO,ACCESSO TOTALE,GRATUITO,,,,,,,NO,NO,NO,,2019,6887,5986,3943,662,239,,(2019:6887)|(2018:7419)|(2017:7601)|(2016:9485)|(2015:9558),SI,SI,NO,NO,NO,NO,NO,Il museo è in fase di riorganizzazione della propria biblioteca specialistica e degli spazi destinati all'archivio dei materiali e della documentazione.,SI,SI,NO,NO,"Informazioni sul museo sono presenti sul sito web della Rete dei musei archeologici della Lombardia, della quale il museo di Manerba fa parte, e nello specifico sito www.riservaroccamanerba.com.",10.5694184,45.5565778,"(45.5565778, 10.5694184)"
1401,1522,LC,GALBIATE,MUSEO ETNOGRAFICO DELL'ALTA BRIANZA,Museo Etnografico Dell'Alta Brianza,Loc. Camporeso,,23851,0341542266,0341240216,meab@parcobarro.it,http://meab.parcobarro.it,,,Museo,Etnografica e Antropologica,ENTE PUBBLICO,SI,,,"MA-ME-VE-SA-DO: 9.00-12.30

 Sabato e Domenica 14.00-18.00","MA-ME-VE-SA-DO:9.00-12.30
SA-DO: 14.00-18.00",lunedì; giovedì,,SI,SI,SI,SI,NO,SI,NO,SI,,NO,NO,SI,NO,,SI,SI,NO,NO,ACCESSO TOTALE,A PAGAMENTO,,2,1,1,15,,SI,SI,SI,,2019,1412,906,,357,149,Il MEAB è stato chiuso per circa 4 mesi per l'inagibilità della strada di accesso a Camporeso.,(2019:1412)|(2018:2130)|(2017:2447)|(2016:2745)|(2015:2686),NO,SI,SI,NO,SI,SI,NO,,SI,SI,SI,NO,Vedi sito http://meab.parcobarro.it,9.3752939,45.8174172,"(45.8174172, 9.3752939)"
4199,4172,BS,BRESCIA,Museo della Mille Miglia Città di Brescia,Museo della Mille Miglia,viale della Bornata 123,,25135,303365631,,segreteria@museomillemiglia.it,http://www.museomillemiglia.it,,,Raccolta Museale,Specializzato,ASSOCIAZIONE RICONOSCIUTA,SI,,,,tutti i giorni dalle ore 10:00 alle ore 18:00,,,SI,SI,SI,NO,SI,SI,SI,NO,,NO,NO,NO,NO,,SI,SI,,,ACCESSO TOTALE,A PAGAMENTO,,10,8,8,4,,NO,SI,NO,,2019,18138,9351,4000,260,4527,,(2019:18138),NO,NO,NO,NO,NO,NO,SI,archivio storico contenete circa 130.000 documenti riguardanti la Mille Miglia storica dal 1927 al 1957 completametne scansionato,NO,NO,NO,NO,,10.267267,45.524556,"(45.524556, 10.267267)"
2082,2440,BG,ARDESIO,MUSEO ETNOGRAFICO DELL' ALTA VALLE SERIANA (MeTA),Casa rurale,"Via T. Tasso, 2",,24020,0346 33035,0346 34280,meta@comune.ardesio.bg.it,http://www.viviardesio.it,,,Museo,Etnografica e Antropologica,ENTE PUBBLICO,SI,,,APERTURA IN CONCOMITANZA A VISITE GUIDATE DELLA SEDE PRINCIPALE DEL MUSEO,"APERTA E VISITABILE SU RICHIESTA NEI GIORNI DI APERTURA DEL MUSEO E SU PRENOTAZIONE
PERIODO ESTIVO (20/06 - 31/08), NATALIZIO E PASQUALE: 
DAL MARTEDI' AL SABATO: 10.00-12.00/ 16.00 - 18.00
DOMENICA: 10.00-12.00/ 14.00 - 18.00
chiuso il lunedì
PERIODO INVERNALE:
SABATO E DOMENICA: 10.00-12.00/ 16.00 - 18.00
NEL MESE DI SETTEMBRE IL MUSEO CHIUDE PER INVENTARIO E MANUTENZIONI.
Tutti gli altri giorni dell'anno solo su prenotazione.",LUNEDì,Dal 2017 è attiva una convenzione tra il Comune di Ardesio e l'Associazione 'VIVI ARDESIO'  per organizzare l'accoglienza dei visitatori e turisti e gestione delle loro visite.,SI,SI,NO,NO,NO,NO,NO,NO,,NO,NO,NO,NO,,SI,SI,NO,NO,ACCESSO PARZIALE,A PAGAMENTO,Ferragosto,2,1,1,1,0,NO,NO,NO,"Ingresso gratuito per portatori di handicap ed anziani, oltre il sessantacinquesimo anno di età.",2019,450,,,,,Dati stimati.,(2019:450)|(2018:500)|(2017:500)|(2016:850)|(2015:910),NO,SI,SI,SI,SI,NO,SI,Il museo organizza periodicamente incontri seminariali su temi etnografici e di storia del territorio.,NO,NO,NO,NO,Effettua un servizio di risposta all'utenza mediante posta elettronica tramite il sito istituzionale del Comune.,9.93229215,45.9387308,"(45.9387308, 9.93229215)"
1882,1943,BG,VERDELLO,MUSEO DEL TERRITORIO,Museo del Territorio,Viale XI febbraio,,24049,035.870234,035.870234,lafabbricasulviale@tiscali.it,http://www.comune.verdello.bg.it,,,Raccolta Museale,Etnografica e Antropologica,ENTE PUBBLICO,SI,,,,martedì e giovedì dalle 8.30 alle 11.30; sabato dalle 9.30-11.30 / 15.00-17.00,,,SI,SI,NO,NO,SI,NO,NO,SI,,NO,SI,NO,NO,,SI,SI,SI,SI,ACCESSO TOTALE,GRATUITO,,,,,,,NO,NO,NO,,2019,2205,1105,,620,480,DATO STIMATO,(2019:2205)|(2018:2515)|(2017:2880)|(2016:3800)|(2015:3520),NO,SI,SI,SI,NO,SI,NO,,NO,NO,NO,NO,,9.6306437,45.6091422,"(45.6091422, 9.6306437)"
1966,2028,BG,BERGAMO,GALLERIA D'ARTE MODERNA E CONTEMPORANEA,Galleria D'Arte Moderna e Contemporanea,"Via San Tomaso, 53",,24121,035 270272,035 236962,,http://www.gamec.it,,,Museo,Arte,ENTE LOCALE E SUE FORME ASSOCIATIVE E CONSORTILI,SI,,,"La Collezione Permanente è aperta tutti i giorni, ad eccezione del martedì, con questi orari: dalle 09.00 alle 13.00 e dalle 15.00 alle 18.00.
Le Mostre Temporanee, quando presenti, sono aperte tutti i giorni, ad eccezione del martedì, dalle 10.00 alle 19.00, il giovedì dalle 10.00 alle 22.00.","La Collezione Permanente è aperta tutti i giorni, ad eccezione del martedì, dalle 09.00 alle 13.00 e dalle 15.00 alle 18.00. da martedi a domenica dalle 10 alle 13 e dalle 15 alle 19. Lunedi giorno di chiusura
Le Mostre Temporanee, quando presenti, sono aperte tutti i giorni, ad eccezione del martedì, dalle 10.00 alle 19.00 (giovedì 10.00 - 22.00).",Martedì,,SI,SI,SI,SI,SI,SI,SI,SI,,NO,NO,NO,NO,,SI,SI,SI,SI,ACCESSO TOTALE,GRATUITO,,,,,,,NO,SI,NO,"L'ingresso è gratuito per le Collezioni Permanenti, aperte e accessibili tutto l'anno.
L'ingresso è a pagamento per le Mostre Temporaneeed a pagamento con tariffe variabili, che prevedono sempre agevolazioni per le famiglie e la gratuità per le scuole di ogni ordine e grado.",2019,103440,96372,7070,6070,998,"Il numero di visitatori delle categorie under 18, over 60 
è da considerare incluso nel conteggio visitatori singoli",(2019:103440)|(2018:61077)|(2017:45234)|(2016:54542)|(2015:67516),NO,SI,SI,SI,SI,SI,NO,,NO,NO,NO,NO,,9.6762593,45.7036928,"(45.7036928, 9.6762593)"
1001,1182,CR,CREMONA,MUSEO CIVICO ALA PONZONE,Museo Civico Ala Ponzone,"Via Ugolani Dati, 4",,26100,0372 407269,0372 407260,museo.alaponzone@comune.cremona.it,http://www.musei.comune.cremona.it,,,Museo,Arte,ENTE LOCALE E SUE FORME ASSOCIATIVE E CONSORTILI,SI,,,,"martedì-domenica 10,00-17,00",lunedì,,SI,NO,SI,SI,NO,SI,SI,NO,,NO,SI,NO,SI,,SI,SI,SI,NO,ACCESSO TOTALE,A PAGAMENTO,,7,5,,,,SI,NO,SI,E' previsto anche l'ingresso gratuito per particolari categorie di visitatori ed il biglietto ridotto riguarda anche gruppi organizzati e scuole.,2019,18795,17144,,1651,,I visitatori in gruppo organizzato non sono rilevati.,(2019:18795)|(2018:23217)|(2017:21692)|(2016:12434)|(2015:10537),SI,SI,SI,SI,SI,SI,NO,,NO,NO,NO,NO,,10.0215837,45.1379338,"(45.1379338, 10.0215837)"
521,663,BS,LONATO DEL GARDA,MUSEO CASA DEL PODESTA',Casa del Podestà,"Via Rocca, 2",,25017,030 913060,030 9130060,info@fondazioneugodacomo.it,http://www.fondazioneugodacomo.it,,,Museo,Casa-Museo,ENTE DI DIRITTO PRIVATO,SI,,,Il Museo è aperto al pubblico dal 1993. Dall'apertura di alcune sale si è passati oggi alla completa visitabilità degli ambienti.,"Dal LUNEDI' alla DOMENICA e festivi
dalle 10.00 alle 12.00 e dalle 14,30 alle 18,30

In orari particolari è previsto l'accesso attraverso appuntamento.",,,SI,SI,SI,SI,SI,SI,SI,NO,"I gruppi numerosi possono essere accolti nei giardini privati, nella Sala di Lettura non facente parte dell'edificio museale ma attigua e pertinenza del complesso museale. E' stata realizzata la caffetteria-ristorante presso la foresteria dell'edificio che ospita la casa-museo.",NO,NO,NO,NO,,SI,SI,SI,NO,ACCESSO PARZIALE,A PAGAMENTO,Particolari occasioni.,6,3,3,3,,NO,SI,NO,"I biglietti del museo si vendono anche presso la biglietteria della Rocca visconteo veneta, di proprietà della Fondazione Ugo Da Como, visitabile con un biglietto cumulativo scontato. Il complesso monumentale infatti comprende la Casa del Podestà e la Rocca visconteo veneta con il Museo Ornitologico.
In forza di una Convenzione stipulata nel 2006 con il Comune di Lonato i cittadini residenti e tutti gli alunni di ogni ordine e grado iscritti alle scuole lonatesi, accedono al Museo con un particolare biglietto ridotto.",2019,14916,11716,4743,3000,200,n° visitatori in gruppo scolastico e n° visitatori in gruppo organizzato sono stimati; si specifica inoltre che il complesso monumentale della Fondazione comprende anche la Rocca visconteo veneta e se si sommano i visitatori anche della Rocca il totale complessivo sale a 33176. Sono esclusi da questi conteggi i visitatori che entrano in occasione degli eventi,(2019:14916)|(2018:)|(2017:14922)|(2016:14922)|(2015:12367),NO,SI,SI,SI,SI,SI,NO,,SI,SI,SI,SI,,10.4858111,45.4613211,"(45.4613211, 10.4858111)"
2244,2298,VA,BUSTO ARSIZIO,MUSEO DEL TESSILE E DELLA TRADIZIONE INDUSTRIALE,Museo del Tessile e della Tradizione Industr. ex Cotonificio Bustese,Via Alesandro Volta 6/8,,21052,0331 627983,,,,,"Nella sede non esiste collegamento fax ed internet che invece sono attivi rispettivamente presso l'Ufficio  musei dislocato in altra  sede.
E-mail museibusto@comune.bustoarsizio.va.it
Sito web www.comune.bustoarsizio.va.it",Museo,Specializzato,ENTE LOCALE E SUE FORME ASSOCIATIVE E CONSORTILI,SI,,,,"martedì-sabato 15.00-19.00
domenica 10.00-12.00, 16.00-19.00
chiuso il lunedì",lunedì,"il museo osserva circa 1 mese di chiusura estiva, tra fine luglio e fine agosto",SI,SI,NO,SI,SI,SI,SI,SI,"La Reception situata all'ingresso del Museo, funziona come punto informazioni, book-shop.

accanto ad essa è stata creata di recente un'area guardaroba dedicata in particolare alle scolaresche, con armadiettio per ricovero zaini",NO,NO,NO,NO,"Il 2.2.2002 è stata inaugurata la Sala delle Esperienze. Essa permette, ai non vedenti e ipovedenti oltre alla normale utenza, di comprendere il ciclo di lavorazione tessile, ovvero le fasi della filatura, tessitura e stampa. Dal marzo 2006 esiste un laboratorio didattico sulla tintoria filati e tessuti e sul colore nell'ambito di Progetto EST e dal marzo 2008 esiste  un laborayorio sulla fenomenologia e percezione colore",SI,SI,SI,NO,ACCESSO PARZIALE,GRATUITO,,,,,,,,,,,2019,16000,12095,7100,2975,930,dati stimati riguardo ai visitatori singoli,(2019:16000)|(2018:15260)|(2017:14000)|(2016:15000)|(2015:21100),NO,SI,SI,SI,SI,NO,SI,"Presso il Museo è conservato l'archivio fotografico dello studio Paracchi, attivo a Busto Arsizio dal 1896 al 1982. Di esso è stato redatto il catalogo (1896 - 1970), consultabile dal pubblico su appuntamento.

le fotografie digitali dei materiali in collezione, contenute nel catalogo informatico del museo,presso gli uffici, sono consultabili dagli studiosi su richiesta.",SI,SI,NO,NO,"Sito Museo, con brevi cenni sulle collezioni ed elenco laboratori didattici proposti, oltre che rubrica con evidenziazione delle inizitiove culturali in corso.

Sul sito Comune Busto è inoltre possibile prenotare visite guidate e laboratori didattici.

Sul sito è pure consultabile  il catalogo completo della Biblioteca specialistica del museo.",8.8472505,45.6137617,"(45.6137617, 8.8472505)"
141,324,CO,COMO,MUSEI CIVICI,Palazzo Olginati,"Piazza Medaglie d'Oro, 6",,22100,031 252550,031 268053,musei.civici@comune.como.it,,,,Museo,Composito,ENTE PUBBLICO,SI,,,,martedì-domenica: 10.00-18.00,lunedì,,SI,SI,SI,SI,SI,SI,NO,NO,In comune con Museo Archeologico.,NO,NO,NO,NO,,SI,SI,SI,NO,ACCESSO TOTALE,A PAGAMENTO,Ingresso gratuito la prima domenica di ogni mese.,4,2,2,1,1,SI,SI,SI,"Biglietto ridotto ad 1 euro per studenti, Enti, Istituti, Associazioni convenzionati; ridotto a 2 euro per pensionati.
Biglietto unico per la visita ai Musei Civici, al costo di 6 euro. Il biglietto unico ha validità di tre giorni, quattro se il terzo giorno cade di lunedì, giorno di chiusura dei Musei Civici.",2019,36362,,,,,"Fanno capo ai Musei Civici il Museo Archeologico e Storico, Pinacoteca e Tempio Voltiano. Si segnalano inoltre i 75.930 visitatori di Villa Olmo, bene monumentale ad accesso gratuito.",(2019:36362)|(2018:50295)|(2017:52665)|(2016:52889)|(2015:48280),NO,SI,SI,SI,SI,SI,NO,,SI,NO,NO,SI,Sistema bibliotecario on line.,9.086093,45.8086462,"(45.8086462, 9.086093)"
2547,2703,MI,MILANO,MUSEO MARTINITT E STELLINE,"MUSEO MARTINITT E STELLINE, CORSO MAGENTA 57 MILANO",CORSO MAGENTA 57,,20123,02.430065.1,02.430065.43,museo@pioalbergotrivulzio.it,http://www.pioalbergotrivulzio.it,,,Museo,Composito,ENTE PUBBLICO,SI,,,,"DA MARTEDì A SABATO
DALLE 10.30 ALLE 18.30",lunedì,,SI,SI,NO,SI,SI,SI,SI,NO,,NO,NO,NO,NO,,SI,SI,SI,SI,ACCESSO TOTALE,GRATUITO,,,,,,,NO,SI,SI,,2019,15000,,,,,,(2019:15000)|(2018:15121)|(2017:14300)|(2016:10403)|(2015:9207),SI,SI,SI,SI,NO,SI,SI,"LA FOTOTECA ESISTENTE NON è ANCORA SCHEDATA
CONSULTAZIONE DEGLI ARCHIVI STORICI",NO,NO,NO,NO,,9.1731557,45.4657246,"(45.4657246, 9.1731557)"
2586,2777,MI,MILANO,MUSEI ARCHEOLOGICI,Museo di Preistoria e Protostoria,"Castello Sforzesco, Piazza Castello, 3",,20121,02/88467779,,c.museoarcheologico@comune.milano.it,http://www.milanocastello.it,,,Museo,Archeologia,ENTE PUBBLICO,SI,,,,Dalle 9 alle 17.30 dal martedì alla domenica,lunedì,,,,SI,NO,NO,SI,NO,NO,La biglietteria e il book-shop servono tutti i musei del Castello. Il book-shop è dato in concessione.,NO,NO,NO,NO,,SI,SI,NO,NO,ACCESSO TOTALE,A PAGAMENTO,1°-3° martedì del mese dalle ore 14.00; prima domenica del mese,5,3,,0,,SI,SI,SI,"Esiste la possibilità di acquistare un biglietto cumulativo per alcuni musei civici nelle varie sedi.

Studenti fino ad anni 18 ingresso gratuito. Ridotto per ultrasessantacinquenni e convenzionati (es. TCI)

Ingresso gratuito per le persone disabili più l'accompagnatore",2019,46074,,,,,,(2019:46074)|(2018:49918)|(2017:113181)|(2016:150823)|(2015:51834),NO,SI,SI,SI,SI,SI,NO,"A parte il servizio educativo, gli altri servizi sono destinati unicamente agli studiosi.",SI,NO,SI,NO,Sito web museo con informazioni per il pubblico e e-mail e telefono della Direzione e della Didattica del Museo. Esiste anche la pagina facebook istituzionale del museo.,9.180642,45.4685221,"(45.4685221, 9.180642)"
2204,2900,PV,PAVIA,SISTEMA MUSEALE DI ATENEO,Museo di Fisica,"Via Bassi, 6",,27100,0382987687,,lidia.falomobernarduzzi@unipv.it,http://musei.unipv.eu,,,Museo,Composito,UNIVERSITA' STATALI - NON STATALI,SI,,,Le collezioni di Fisica sono visitabili nei normali orari di apertura del Dipartimento ospitante,Il Museo di Fisica è accessibile negli orari di apertura del Dipartimento di Fisica ospitante: tutti i giorni dalle 8 alle 19 e il sabato mattina dalle 8 alle 13,domenica,,SI,SI,NO,NO,NO,NO,NO,NO,,NO,NO,SI,NO,,SI,SI,SI,NO,ACCESSO TOTALE,A PAGAMENTO,,6,4,,,,NO,NO,NO,"Dal 23 aprile 2016 l'accesso ai musei universitari è a pagamento. Il biglietto d'ingresso, di € 6 (ridotto € 4) ha validità un mese e dà diritto all'accesso a tutti i musei.
L'ingresso è gratuito per gli studenti fino a 26 anni, gli over 65 e i portatori di disabilità. Le scuole accedono gratuitamente e pagano solo la visita guidata € 3 per alunno",2019,29463,,,,,"Dati stimati. Attualmente solo il Museo Kosmos è dotato di biglietteria automatizzata che fornisce reportistica dettagliata. A partire da marzo 2020 è previsto che tutti i Musei acquisiscano un sistema di biglietteria automatizzato, consentendo l'inserimento di dati parziali.",(2019:29463)|(2018:15268)|(2017:10594)|(2016:22194)|(2015:16677),NO,SI,SI,NO,SI,NO,NO,,SI,NO,NO,SI,"E' stato realizzato un sito internet (musei.unipv.eu) dedicato a tutte le collezioni conservate presso l'Università di Pavia, nel quale è possibile reperire informazioni su ubicazione, storia e consistenza delle collezioni, accedere, ove presenti, ai cataloghi informatizzati e compiere, in alcuni casi, visite virtuali.",9.14128515,45.19767279,"(45.19767279, 9.14128515)"
3330,3022,BS,BRESCIA,MUSEO GIOVANNI PIAMARTA,Museo Giovanni Piamarta,"VIA GIOVANNI PIAMARTA, 6",,25121,0302319165,0307281816,congregazione@piamarta.org,http://www.museopiamarta.it,,,Museo,Casa-Museo,ENTE ECCLESIASTICO,SI,,,"Il Museo è aperto
il mattino da lunedì a venerdì, dalle 9.00 alle 13.00 
il pomeriggio da mercoledì a giovedì, dalle 15.00 alle 18.00 
Altri giorni e orari di apertura, le visite guidate e i laboratori si effettuano su appuntamento:
tel. 030 49512 - 366.2867000 
mail: info@auditoriumcapretti.it - info@museopiamarta.it","Il Museo è aperto
il mattino da lunedì a venerdì, dalle 9.00 alle 13.00 
il pomeriggio martedì, mercoledì e sabato dalle 15.00 alle 18.00 
Altri giorni e orari di apertura, le visite guidate e i laboratori si effettuano su appuntamento:
tel. 030 49512  - 366.2867000 
mail: info@auditoriumcapretti.it - info@museopiamarta.it",,,SI,SI,SI,NO,SI,SI,SI,SI,,NO,NO,NO,NO,,SI,SI,NO,SI,ACCESSO PARZIALE,A PAGAMENTO,,3,,,,5,NO,SI,NO,"Il Museo ha funzionato finora all'interno delle strutture legate alla Congregazione Sacra Famiglia di Nazareth, ma in seguito alla canonizzazione di Giovanni Battista Piamarta (21 ottobre 2012) sono state avviate una serie di azioni finalizzate alla sua apertura stabile al pubblico, insieme al Santuario che converva le sue spoglie mortali. Tra queste azioni si intende inserire il Museo all'interno dei circuiti museali di Brescia e di Regione Lombardia, con la possibilità di collocarlo nel sistema dei Musei Lombardia.

Per l'ingresso è stato gratuito, ma con il riconoscimento si fisserà una quota di accesso pari a 3,00 euro, nel caso dell'uso del parcheggio il biglietto (comprensivo del posto auto) è di 5,00 euro.",2019,1637,947,719,442,248,,(2019:1637)|(2018:1277)|MUSEO RICONOSCIUTO NEL 2018,SI,SI,SI,SI,NO,SI,SI,"La biblioteca, l'archivio e la fototeca dedicati alla figura e all'opera di san Giovanni Battista Piamarta sono accessibili al pubblico su appuntamento presso la casa madre della Congregazione in via Ferri 73 a Brescia. 
Alcuni pezzi selezionati della biblioteca, dell'archivio e della fototeca sono presenti nell'allestimento espositivo del Museo.",SI,SI,SI,SI,"Tra le azioni di promozione è stato creato un sito web dedicato al Museo Giovanni Piamarta (in collegamento con quello della Congregazione della Sacra Famiglia di Nazareth, www.piamarta.org) in cui è presentata la casa museo del santo bresciano, il suo santuario e le attività culturali svolte dal Museo, come pure le informazioni utili per i visitatori (orari, come arrivare, disponibilità di parcheggio, ecc.). Nel sito web si troveranno anche i dati necessari per l'accessibilità e la fruibilità delle collezioni da parte del pubblico con disabilità, secondo i dettami della L. 9 gennaio 2004, n. 4.
Inoltre all'interno del sito sono indicati i social media che vengono periodicamente utilizzati per la comunicazione.",10.228684,45.540185,"(45.540185, 10.228684)"
2397,2429,SO,CAMPODOLCINO,MUSEO DELLA VAL SAN GIACOMO E DELLA VIA SPLUGA,Museo della Val San Giacomo e della Via Spluga,piazza S. Antonio 15,Corti,23021,0343 50628,0343 50628,info@museoviaspluga.it,http://www.museoviaspluga.it,,,Raccolta Museale,Composito,ENTE DI DIRITTO PRIVATO,SI,,,"il museo è chiuso il lunedì, il 25 dicembre, il 1 gennaio e due settimane a Novembre","il museo è aperto tutti i giorni nei mesi di luglio e agosto dalle 9,30 alle 12,30 dalle 16,00 alle 18,00
negli altri mesi è chiuso il lunedì, il 25 dicembre il 1 gennaio e due settimane a novembre (2a e 3a settimana) ed è aperto tutte le mattine dalle 9,30 alle 12,30 e il sabato anche dalle 16 alle 18",lunedì (escluso luglio e agosto),,SI,SI,SI,NO,SI,NO,NO,NO,la biglietteria è dotata di uno spazio utilizzato come bookshop,NO,NO,NO,NO,il museo non ha nessun laboratorio,SI,NO,SI,SI,ACCESSO PARZIALE,A PAGAMENTO,in occasione di eventi culturali promossi dal museo,4,3,3,3,,NO,SI,NO,L'ingresso alla Cappella di S. Antonio è gratuito.,2019,3084,1402,,280,1402,"Le celle riguardanti gli under 18, 18-60 over 60 non sono compilate poiché nel numero di visitatori singoli sono conteggiati anche i gruppi scolastici e organizzati divisi per età.",(2019:3084)|(2018:2165)|(2017:3305)|(2016:3093)|(2015:3750),NO,SI,SI,NO,NO,NO,NO,,NO,NO,NO,NO,il sito è in rifacimento e provvedermo ad adeguarci,9.3587564,46.4392007,"(46.4392007, 9.3587564)"
2558,2684,BS,CEDEGOLO,MUSEO DELL'INDUSTRIA E DEL LAVORO DI BRESCIA,MUSEO DELL'ENERGIA IDROELETTRICA,Via Roma 48,,25051,036461196,030 2404554,fondazione@musil.bs.it,http://www.musilcedegolo.it,,,Museo,Scienza e Tecnica,FONDAZIONE (ESCLUSA FONDAZIONE BANCARIA),SI,,,,"Aprile - Maggio - Giugno - Settembre - Ottobre - Novembre
Venerdì 14:00 - 18:00
Sabato	14:00 - 18:00
Domenica	14:00 - 18:00

Luglio - Agosto
Tutti i giorni	14:00 - 19:00

Aperture straordinarie : 17, 24 e 25 Aprile, 1 Maggio 2017.
Il museo è sempre aperto su prenotazione per visite guidate.",,,SI,SI,SI,SI,SI,SI,SI,NO,,NO,NO,NO,NO,,SI,SI,NO,SI,ACCESSO TOTALE,A PAGAMENTO,,4,3,5,5,,NO,NO,NO,,2019,10592,5255,1381,4252,1085,Nella casella Under 18+ Over 60 è stato inserito il totale dei biglietti ridotti singoli (Under 25 + Over 65),(2019:10592)|(2018:11336)|(2017:14650)|(2016:15250)|(2015:16500),SI,SI,SI,SI,SI,SI,NO,,SI,NO,NO,SI,"Il sito www.musilbrescia.it offre ampia possibilità di ricerca sull'intero patrimonio e sull'attività del Museo.
Da circa un anno il Musil è anche molto attivo su Facebook (https://www.facebook.com/musilbrescia/).",10.349402,46.0752421,"(46.0752421, 10.349402)"
